{
  "name": "rayhan",
  "owner": {
    "github": "Rayhan-099"
  },
  "claimedAt": "2026-10-14T16:39:37.087Z",
  "records": {
    "CNAME": "10851802263f8828.vercel-dns-017.com"
  },
  "country": "IN",
  "subdomains": {
    "_vercel": {
      "TXT": [
        "vc-domain-verify=rayhan.runs-on.dev,d96ada6ca4d07e069d97"
      ]
    }
  }
}
