{
  "name": "cristiano",
  "owner": {
    "github": "cristianobleve"
  },
  "claimedAt": "2026-09-17T09:40:38.362Z",
  "records": {},
  "country": "IT",
  "profile": {
    "name": "cristianobleve",
    "links": [
      {
        "label": "Portfolio",
        "url": "https://cristianobleve.com"
      }
    ]
  }
}
