{
  "name": "vathsavv56",
  "owner": {
    "github": "vathsavv56"
  },
  "claimedAt": "2026-09-09T03:36:19.436Z",
  "records": {
    "CNAME": "ebf3b14bb9cc7f17.vercel-dns-017.com"
  },
  "profile": {
    "name": "vathsavv56",
    "bio": "Heyyy",
    "links": [
      {
        "label": "My portfolio",
        "url": "https://vathsavv56.vercel.app/"
      }
    ]
  }
}
