{
  "name": "sdetsumit",
  "owner": {
    "github": "singhsumit880"
  },
  "claimedAt": "2026-09-04T17:45:15.588Z",
  "records": {
    "URL": "https://singhsumit880.github.io/"
  },
  "profile": {
    "name": "Sumit",
    "links": [
      {
        "label": "My Portfolio",
        "url": "https://singhsumit880.github.io/"
      }
    ]
  }
}
