{
  "name": "udaantechsolutions",
  "owner": {
    "github": "Gagan1468"
  },
  "claimedAt": "2026-10-15T15:33:33.148Z",
  "records": {
    "CNAME": "cname.vercel-dns.com"
  },
  "country": "IN",
  "subdomains": {
    "_vercel": {
      "TXT": [
        "vc-domain-verify=udaantechsolutions.runs-on.dev,9a852a1efed94625c2ae"
      ]
    }
  }
}
