{
  "name": "section",
  "owner": {
    "github": "SECT19N"
  },
  "claimedAt": "2026-09-17T13:16:36.984Z",
  "records": {
    "CNAME": "cname.vercel-dns.com"
  },
  "country": "IQ",
  "profile": {
    "name": "SECT19N"
  },
  "subdomains": {
    "_vercel": {
      "TXT": [
        "vc-domain-verify=section.runs-on.dev,da219b943b812206a711"
      ]
    }
  }
}
